21961,https://www.bluer.co.kr/restaurants/21961,이남장(서초점),서울특별시 서초구 서초대로49길 4 (서초동),설렁탕,0,N,N,,https://www.bluer.co.kr/assets/image/restaurant/img_restaruant_no_image.png?v=3,images\21961_이남장(서초점).png,"을지로에서 유명한 설렁탕 전문점의 서초점. 탕에 밥과 쌀로 만든 소면이 말아져 나온다. 청양고추가 들어간 특제 양념장이 나와 고기에 찍어 먹을 수도 있다. 내장탕, 도가니탕 등도 즐길 수 있고 수육도 준비돼 있다. 3층 건물을 매장으로 사용하여 자리가 많다.",127.012383,37.49379129,"이남장(서초점)은 을지로에서 유명한 설렁탕 전문점의 서초지점으로, 서울특별시 서초구 서초대로49길 4(서초동)에 위치해 있습니다. 3층 건물을 매장으로 사용하여 좌석이 넉넉하며, 24시간 영업(명절 연휴 휴무)으로 언제든 방문이 가능합니다. 대표 메뉴인 설렁탕은 밥과 쌀소면이 함께 들어가며, 청양고추가 들어간 특제 양념장에 고기를 찍어 먹는 방식이 특징입니다. 내장탕, 도가니탕, 족탕 등 다양한 국물류와 수육, 족수육, 모둠수육 등 고기류 메뉴도 준비되어 있습니다. 메뉴 가격대는 9,000원(설렁탕)부터 55,000원(대형 수육류)까지로, 합리적인 가격에 다양한 한식 육류 요리를 즐길 수 있습니다. 매장은 교대역 10번 출구에서 도보로 이동 가능하며, 발레파킹도 지원합니다. 맵기가 있는 메뉴(내장탕, 족탕)도 있어 취향에 따라 선택할 수 있습니다. 채식 옵션은 별도로 제공되지 않으며, 모든 메뉴의 주재료는 육류입니다. 리뷰는 아직 등록되어 있지 않습니다.","을지로에서 유명한 설렁탕 전문점의 서초점으로, 한식 전통 국물요리와 다양한 고기류 메뉴를 전문으로 합니다. 3층 규모의 넓은 매장과 24시간 영업으로 언제든 식사가 가능하며, 아침 식사나 늦은 시간 방문에도 적합합니다. 쌀소면이 들어간 설렁탕, 다양한 부위의 수육, 청양고추 특제 양념장 등으로 한국식 소박하면서도 푸짐한 분위기를 느낄 수 있습니다. 가족 단위, 단체, 직장인들의 식사, 든든한 한끼가 필요한 이들에게 잘 어울리는 클래식한 한식당입니다.","{'budget_range': '중', 'spicy_available': 'O', 'vegetarian_options': 'X', 'main_ingredients_list': ['육류'], 'low_level_category': '설렁탕', 'suitable_for': ['가족모임', '단체식사', '아침식사', '24시간', '전통적', '넓은매장', '직장인', '든든한식사'], 'food_type_list': ['국물류', '고기류'], 'temperature_list': ['온'], 'high_level_category': '한식'}"
634,https://www.bluer.co.kr/restaurants/634,영양센타,서울특별시 중구 명동2길 52 (충무로1가) 대용빌딩,"전기구이통닭, 삼계탕",0,Y,Y,레드리본 선정 서울 2025 선정,https://www.bluer.co.kr/images/634_thumb.jpg,images\634_영양센타.jpg,"1960년부터 명동을 지키고 있는 터줏대감으로, 전기구이 통닭의 원조집이다. 당시에 통닭은 범국민적인 영양식이었고, 영양센타는 서울 곳곳에 분점을 거느리고 있었다. 옛날의 향수에 젖어 찾는 사람이 아직도 많이 있다. 맥주와 함께하면 금상첨화. 여름에는 삼계탕도 좋다.",126.9831231,37.56111144,"영양센타는 1960년 개업 이래 서울 명동을 대표하는 전기구이 통닭의 원조집으로, 오랜 세월 동안 명동을 지켜온 터줏대감입니다. 전통과 향수를 간직한 이곳은 예전에는 서울 곳곳에 분점을 두고 있었으며, 지금도 옛날 맛을 그리워하는 손님들이 많이 찾는 곳입니다. 대표 메뉴는 전기구이 통닭과 삼계탕으로, 통닭은 중(20,500원), 대(21,500원) 사이즈로 제공되며, 삼계탕(20,500원), 들깨삼계탕(22,500원), 산삼삼계탕(26,500원) 등 다양한 삼계탕 메뉴도 마련되어 있습니다. 통닭정식(15,000원)도 준비되어 있어 다양한 선택이 가능합니다. 모든 메뉴는 맵지 않으며, 주재료는 닭고기(조류)입니다. 가족 외식, 외국인 접대, 오랜 역사가 느껴지는 식사를 원한다면 적합한 곳으로, 레드리본 맛집이자 '서울 2025' 선정 맛집입니다. 영업시간은 매일 10:30~22:30이며, 명절 당일에는 휴무입니다. 명동역 5번 출구에서 도보로 쉽게 찾아갈 수 있습니다. 코카콜라와 함께 즐기는 전통 통닭과 삼계탕, 그리고 맥주와의 조합이 특히 추천됩니다. 실내 분위기는 가족모임, 외국인 접대 등 다양한 상황에 어울리며, 현재 블루리본 서베이 2025년판에 수록되어 있습니다.","영양센타는 전기구이 통닭과 삼계탕을 전문으로 하는 한식 레드리본 선정 맛집으로, 1960년부터 명동을 지켜온 오랜 역사의 터줏대감입니다. 전통적인 분위기와 옛날의 향수를 간직하고 있어 가족 외식이나 외국인 접대에 적합하며, 맥주와 함께 즐기기에도 좋습니다. 코카-콜라와 어울리는 전통 한식 메뉴를 제공하며, 서울 2025 선정 등 신뢰받는 맛집으로 평가받고 있습니다.","{'budget_range': '중', 'spicy_available': 'X', 'vegetarian_options': 'X', 'main_ingredients_list': ['조류'], 'low_level_category': '전기구이통닭, 삼계탕', 'suitable_for': ['레드리본', '서울 2025', '가족모임', '외국인 접대', '역사/전통', '옛날 분위기'], 'food_type_list': ['고기류', '국물류'], 'temperature_list': ['온'], 'high_level_category': '한식'}"
29926,https://www.bluer.co.kr/restaurants/29926,에피세리꼴라주,서울특별시 용산구 한남대로20길 47-24 (한남동) 1층,"프렌치비스트로, 브런치카페",0,N,N,,https://www.bluer.co.kr/assets/image/restaurant/img_restaruant_no_image.png?v=3,images\29926_에피세리꼴라주.png,"프렌치 베이스에 이탈리안, 재퍼니즈 등 다양한 요소를 더한 퓨전 요리를 선보이는 유러피안 비스트로. 바게트로 만든 프렌치토스트와 겉은 바삭하고 속은 촉촉한 스타일의 와규럼프스테이크, 샴페인 거품을 올린 새우오일파스타 등이 인기 메뉴다. 평일에는 시간대별로 브런치, 카페, 디너로 나누어 운영된다.",127.0100534,37.53536654,"에피세리꼴라주는 서울 용산구 한남동에 위치한 유러피안 비스트로로, 프렌치 요리를 기반으로 이탈리안과 재퍼니즈 등 다양한 요소를 접목한 퓨전 스타일의 음식을 선보입니다. 2014년에 개업하였으며, 평일에는 브런치, 카페, 디너로 시간대별로 운영됩니다. 바게트로 만든 프렌치토스트, 겉은 바삭하고 속은 촉촉한 와규럼프스테이크(150g), 샴페인 거품을 올린 새우오일파스타가 대표 인기 메뉴입니다. 이 외에도 부야베스, 이집트콩허머스, 햄치즈에그크레페, 크나페, 에그베네딕트, 양고기볼로네제탈리아텔레, 게살레몬버터탈리타텔레, 치그플레이트, 페르시안풍폭립감자스튜 등 다양한 메뉴가 준비되어 있습니다. 메뉴 가격대는 13,000원에서 49,000원 사이로, 중상급 수준입니다. 모든 메뉴는 맵지 않으며, 주재료는 육류, 어류, 패류, 조류 등 다양한 재료가 사용됩니다. 채식이나 비건 메뉴는 따로 확인되지 않습니다. 한남오거리에서 한남초등학교 방면으로 직진, 기업은행에서 우회전 후 직진하면 우측에 위치해 있습니다. 연인과 함께 브런치나 식사를 즐기기에 좋은 분위기로, 발레파킹이 제공됩니다. 영업시간은 화~토요일 11:00~22:00(마지막 주문 20:30), 일요일 11:00~18:30(마지막 주문 17:00), 매주 월요일은 휴무입니다.","프렌치 비스트로를 기반으로 이탈리안, 재퍼니즈 등 다양한 유럽 및 아시아 요소를 접목한 창의적인 퓨전 요리를 선보이는 곳입니다. 대표 메뉴로는 바게트 프렌치토스트, 겉바속촉 와규럼프스테이크, 샴페인 거품을 올린 새우오일파스타 등이 있으며, 브런치와 디너 모두 분위기 있게 즐길 수 있습니다. 연인과 함께 방문하기 좋은 감각적인 공간으로, 트렌디한 유러피안 브런치와 식사를 경험할 수 있습니다.","{'budget_range': '중', 'spicy_available': 'X', 'vegetarian_options': 'X', 'main_ingredients_list': ['기타', '어류', '육류', '조류', '패류'], 'low_level_category': '프렌치비스트로, 브런치카페', 'suitable_for': ['데이트', '연인', '브런치', '트렌디', '감각적인', '분위기 좋은'], 'food_type_list': ['디저트류', '국물류', '기타', '면류', '고기류'], 'temperature_list': ['온', '상'], 'high_level_category': '양식'}"
36616,https://www.bluer.co.kr/restaurants/36616,브릭샌드(강남역점),서울특별시 강남구 강남대로 지하396 (역삼동) 신분당선 지하1층,구움과자,0,N,N,,https://www.bluer.co.kr/images/bluer_27f20d47993f43f887e65f7e729775aa.jpg,images\36616_브릭샌드(강남역점).jpg,바삭하면서도 촉촉한 식감이 일품인 벽돌 모양의 피낭시에 전문점. 보는 즐거움과 먹는 즐거움을 함께 느낄 수 있다. 달콤한 디저트와 함께 마시는 커피가 조화롭다. 선물포장용이 따로 준비되어 있어서 가까운 지인에게 선물하기도 좋다.,127.0283079,37.49816465,"브릭샌드(강남역점)는 서울 강남구 신분당선 강남역 지하 1층에 위치한 피낭시에(구움과자) 전문 디저트 카페입니다. 이곳은 벽돌 모양의 개성 있는 피낭시에를 중심으로 다양한 브릭 메뉴(기본브릭, 포레스트브릭, 헤이즈브릭, 아몽브릭, 달콤브릭, 다크브릭, 루비브릭, 말차브릭, 코코브릭, 오렌지브릭, 카라멜브릭 등)를 2,000원~2,800원의 합리적인 가격대에 제공합니다. 대표 메뉴들은 바삭하면서도 촉촉한 식감이 특징이며, 커피와 함께 즐기기 좋습니다. 선물 포장 서비스가 마련되어 있어 가까운 지인에게 선물하기에도 적합합니다. 매장은 화~일요일 09:00~19:00에 영업하며, 매주 월요일은 휴무입니다. 2022년 3월 14일에 개업하였으며, 서울역점과 인사동점 등 분점도 운영 중입니다. 현재 블루리본, 서울 2025 등 별도의 선정 이력은 없으나, 독특한 디저트 경험과 선물용으로의 활용도, 트렌디한 분위기가 돋보입니다. 맵거나 채식 메뉴는 없으며, 모든 메뉴는 달콤한 디저트류로 구성되어 있습니다.","브릭샌드(강남역점)는 바삭하고 촉촉한 식감의 벽돌 모양 피낭시에를 전문으로 하는 디저트 카페입니다. 보는 즐거움과 먹는 즐거움을 동시에 제공하며, 달콤한 디저트와 커피의 조화가 특징입니다. 선물 포장 서비스가 준비되어 있어 지인 선물용으로도 적합합니다. 트렌디하고 감각적인 분위기에서 색다른 디저트 경험을 즐길 수 있습니다.","{'budget_range': '저', 'spicy_available': 'X', 'vegetarian_options': 'X', 'main_ingredients_list': ['기타'], 'low_level_category': '구움과자', 'suitable_for': ['선물', '트렌디함', '감각적인', '디저트', '지인선물', '색다른 경험'], 'food_type_list': ['기타', '디저트류'], 'temperature_list': ['상'], 'high_level_category': '디저트류'}"
39518,https://www.bluer.co.kr/restaurants/39518,영등포꽃삼,서울특별시 영등포구 영중로4길 6 (영등포동3가),돼지고기구이,0,N,N,,https://www.bluer.co.kr/assets/image/restaurant/img_restaruant_no_image.png?v=3,images\39518_영등포꽃삼.png,"통삼겹살, 통목살, 항정살, 갈매기살을 맛볼 수 있는 고깃집. 고기는 직접 구워주며, 명란젓과 다진 마늘을 넣은 특제 양념에 찍어 먹는다. 한우육회와 소고기 된장술밥도 추천하는 메뉴다. 볶음밥을 주문해 고기와 함께 먹어도 좋다. 가족모임과 회식을 하기에도 좋은 편이다.",126.9070417,37.5170723,"영등포꽃삼은 서울 영등포구 영중로4길에 위치한 돼지고기구이 전문점으로, 2023년 8월에 개업했습니다. 이곳에서는 통삼겹살, 통목살, 항정살, 갈매기살 등 다양한 돼지고기 부위를 직접 구워주며, 명란젓과 다진 마늘이 들어간 특제 양념에 찍어 먹는 것이 특징입니다. 한우육회와 소고기된장술밥도 인기 메뉴로 추천되며, 볶음밥을 추가해 고기와 함께 먹는 것도 인기가 많습니다. 주요 메뉴로는 통삼겹살(160g), 통목살(160g), 항정살(160g), 갈매기살(160g), 한우육회, 소고기된장술밥, 물냉면, 비빔냉면, 볶음밥한판 등이 있으며, 가격대는 6,000원에서 23,000원 사이로 형성되어 있습니다. 영업시간은 매일 11:30부터 다음날 24:00까지(마지막 주문 23:30)이며, 연중무휴로 운영됩니다. 가족 모임이나 회식 등 단체 손님에게도 적합한 분위기이며, 넉넉한 영업시간과 다양한 메뉴, 직접 구워주는 서비스가 장점으로 꼽힙니다. 매장 내 리뷰는 아직 등록되어 있지 않습니다. 인스타그램(@flower_ydpork) 계정을 운영하고 있습니다.","직접 고기를 구워주는 돼지고기구이 전문점으로, 통삼겹살, 통목살, 항정살, 갈매기살 등 다양한 부위를 특제 명란젓 마늘 양념에 찍어 먹는 것이 특징입니다. 한우육회와 소고기된장술밥, 볶음밥 등도 제공하며, 한식 테마의 다양한 메뉴로 가족모임이나 회식 등 단체 식사에 잘 어울리는 활기찬 분위기의 고깃집입니다.","{'budget_range': '중', 'spicy_available': 'O', 'vegetarian_options': 'X', 'main_ingredients_list': ['기타', '육류'], 'low_level_category': '돼지고기구이', 'suitable_for': ['가족모임', '회식', '단체', '활기찬', '직접구이'], 'food_type_list': ['면류', '국물류', '밥류', '고기류'], 'temperature_list': ['냉', '온', '생'], 'high_level_category': '한식'}"
16285,https://www.bluer.co.kr/restaurants/16285,도마(홍대본점),서울특별시 마포구 양화로16길 33 (서교동),소고기구이,1,Y,Y,레드리본 선정 서울 2025 선정,https://www.bluer.co.kr/assets/image/restaurant/img_restaruant_no_image.png?v=3,images\16285_도마(홍대본점).png,"미국산 소고기구이 전문점으로, 미국 네브래스카산 30개월 미만의 소고기를 사용한다. 주력 메뉴는 갈빗살. 미국산 소고기이지만 유통기간 3개월의 냉장 소고기를 사용해 맛이 좋다. 마무리로 마약된장찌개를 밥과 비벼 먹는 게 별미다.",126.9214284,37.55308186,"도마(홍대본점)는 서울 마포구 서교동에 위치한 미국산 소고기구이 전문점으로, 블루리본 서베이의 레드리본 맛집이자 '서울 2025'에 선정된 곳입니다. 미국 네브래스카산 30개월 미만의 소고기만을 사용하며, 3개월 이내 유통된 신선한 냉장육을 고집합니다. 대표 메뉴는 갈빗살(150g, 20,000원)이며, 꽃살, 진갈비살, 갈비본살 등 다양한 부위의 소고기를 맛볼 수 있습니다. 모둠A(27,000원)와 모둠B(29,000원) 세트 메뉴도 인기이며, 식사 메뉴로 육회비빔밥(14,000원)과 마약된장찌개(8,000원)가 준비되어 있습니다. 마약된장찌개는 밥과 비벼 먹는 별미로 마무리 메뉴로 추천됩니다. 가격대는 8,000원~39,000원으로 중간 수준이며, 한식 테마의 고기류와 국물류, 밥류 메뉴가 제공됩니다. 외국인 접대에 적합하다는 평을 받고 있으며, 주차장 이용 시 주차비 지원, 인스타그램 운영 등 편의 서비스도 제공됩니다. 영업시간은 월~목, 일요일 14:00~23:00(마지막 주문 23:30), 금~토 14:00~24:00(마지막 주문 00:30)이며, 다섯째주 월요일은 휴무입니다.","미국산 네브래스카산 소고기를 전문적으로 취급하는 한식 소고기구이 레스토랑으로, 신선한 냉장육을 사용하여 고기 본연의 맛을 강조합니다. 대표 메뉴는 갈빗살이며, 다양한 부위와 모둠 메뉴를 제공해 소고기 애호가들에게 적합합니다. 식사 마무리로 마약된장찌개를 밥과 비벼 먹는 것이 별미로 꼽힙니다. 한식 테마의 고기류와 국물류, 밥류가 주를 이루며, 외국인 접대에 좋은 분위기와 프리미엄 한식 다이닝의 정체성을 갖추고 있습니다. 레드리본 선정 및 서울 2025 맛집에 선정된 신뢰도 높은 곳으로, 캐주얼하면서도 품질 높은 고기구이를 경험할 수 있습니다.","{'budget_range': '중', 'spicy_available': 'X', 'vegetarian_options': 'X', 'main_ingredients_list': ['육류', '기타'], 'low_level_category': '소고기구이', 'suitable_for': ['레드리본', '서울 2025', '외국인 접대', '프리미엄', '고기구이', '한식'], 'food_type_list': ['고기류', '밥류', '국물류'], 'temperature_list': ['온', '생'], 'high_level_category': '한식'}"
36421,https://www.bluer.co.kr/restaurants/36421,루비스(한남점),서울특별시 용산구 이태원로55가길 21 (한남동),"호주식브런치, 브런치카페",0,N,N,,https://www.bluer.co.kr/images/bluer_a979e5ced6d34d24bf5d7afd6eca3e0f.jpg,images\36421_루비스(한남점).jpg,뉴욕의 유명 브런치카페인 루비스카페에서 오픈한 곳. 시그니처는 치아바타번을 활용한 브론테버거와 슈림프파스타다. 도산공원을 마주하고 있어 창가뷰도 좋다. 날씨가 좋을 땐 흰 천막 아래 테라스에서 식사하는 것도 추천한다.,127.0002393,37.53738349,"루비스(한남점)는 2002년 뉴욕에서 시작된 올데이 다이닝 레스토랑 '루비스카페'의 세 번째 해외 매장으로, 서울 용산구 한남동에 위치해 있습니다. 이곳은 호주식 브런치와 브런치카페로 분류되며, 다양한 식재료를 활용한 브런치부터 다이닝 메뉴까지 제공하는 것이 특징입니다. 대표 메뉴로는 100% 소고기 목심을 사용한 시그니처 '브론테버거', 신선한 해산물이 들어간 '레몬쉬림프파스타', '루비스행거스테이크', '하몽루꼴라뇨끼', '허니콤팬케이크', '치킨아보카도샐러드', '락피시크리미리조또', 그리고 디저트인 '루비스초코무스' 등이 있습니다. 음료로는 아메리카노와 카페라테도 준비되어 있습니다. 메뉴 가격대는 5,500원부터 45,000원까지로, 전반적으로 중~고가에 해당합니다. 모든 메뉴는 맵지 않으며, 주재료로는 육류, 패류, 조류, 기타 등이 사용되고 있습니다. 채식 및 비건 옵션은 별도로 제공되지 않습니다. 매장은 도산공원을 마주보고 있어 창가 전망이 좋으며, 흰 천막 아래 테라스 좌석도 마련되어 있어 날씨가 좋을 때 야외 식사가 가능합니다. 뉴욕의 분위기를 그대로 재현한 인테리어와 활기찬 브런치, 다이닝 경험을 제공하며, 주류 및 음료 페어링도 가능합니다. 발레파킹 서비스(90분 4천원, 이후 30분당 2천원)가 제공되고, 영업시간은 월~금 09:30~21:00(브레이크타임 15:00~17:00), 토~일 09:30~21:00입니다. 예약 및 자세한 정보는 인스타그램(@rubyscafe.seoul)에서도 확인할 수 있습니다.","뉴욕에서 시작된 해외 유명 브런치 브랜드의 서울 분점으로, 호주식 브런치와 다양한 양식 메뉴를 올데이 다이닝 형태로 제공하는 활기차고 트렌디한 레스토랑입니다. 창가 전망과 흰 천막 아래 테라스가 있어 개방감과 여유로운 분위기를 즐길 수 있으며, 뉴욕 감성을 살린 인테리어와 함께 브런치부터 다이닝까지 다양한 식사 경험을 선사합니다. 시그니처 브론테버거, 슈림프파스타 등 개성 있는 메뉴와 주류, 음료 페어링이 강점입니다. 친구, 연인, 가족과의 캐주얼한 모임이나 트렌디한 데이트에 적합하며, 해외 감성과 특별한 분위기를 원하는 고객에게 추천됩니다.","{'budget_range': '중~고', 'spicy_available': 'X', 'vegetarian_options': 'X', 'main_ingredients_list': ['육류', '패류', '기타', '조류'], 'low_level_category': '호주식브런치, 브런치카페', 'suitable_for': ['트렌디한', '데이트', '모임', '야외식사', '해외분위기', '브런치', '가족', '친구'], 'food_type_list': ['기타', '면류', '디저트류', '밥류', '음료'], 'temperature_list': ['온', '상', '냉', '기타'], 'high_level_category': '양식'}"
32749,https://www.bluer.co.kr/restaurants/32749,성북동면옥집,서울특별시 성북구 대사관로 40 (성북동),"갈비탕, 소갈비찜, 비빔냉면",0,N,N,,https://www.bluer.co.kr/assets/image/restaurant/img_restaruant_no_image.png?v=3,images\32749_성북동면옥집.png,"갈비찜으로 유명한 냉면집. 큼직한 갈빗대에 살이 두툼하게 붙어있는 왕갈비찜으로, 서빙하면서 뼈를 발라줘 먹기 편하다. 자작한 국물에 고깃살이 야들야들하고 부드러우면서 간이 잘 배어있다. 후식용 냉면과 곁들이면 더욱 만족스럽다.",126.9886308,37.59589362,"성북동면옥집은 서울 성북구 대사관로에 위치한 2015년 개업의 한식 전문점으로, 갈비찜과 냉면이 대표 메뉴인 곳입니다. 이곳의 대표 메뉴인 왕갈비찜은 큼직한 갈빗대에 두툼한 살이 붙어 있으며, 서빙 시 직원이 직접 뼈를 발라주어 먹기 편하게 제공됩니다. 자작한 국물에 부드러운 고기가 특징이며, 간이 잘 배어 있어 깊은 풍미를 자랑합니다. 식사 후에는 후식용 냉면(물냉면, 비빔냉면, 회냉면 등)과 함께 즐기면 더욱 만족스럽다는 평가를 받고 있습니다. 주요 메뉴로는 왕갈비찜(소 59,000원, 중 69,000원, 대 79,000원), 오색만두(10,000원), 왕갈비탕(16,000원), 모둠전(20,000원/30,000원), 물냉면(10,000원), 비빔냉면(10,000원), 회냉면(11,000원) 등이 있으며, 전체적으로 1인당 10,000원~79,000원의 가격대입니다. 모든 메뉴는 한식 테마로, 고기류와 면류, 기타 한식 메뉴가 고루 갖추어져 있습니다. 비빔냉면을 제외하면 대부분 맵지 않으며, 주재료는 육류와 어류, 기타가 혼합되어 있습니다. 발레파킹이 제공되고, 영업시간은 매일 11:00~22:00입니다. 레드리본이나 서울 2025 선정은 없으나, 블루리본 Pick에 선정된 이력이 있습니다. 가족모임, 단체식사, 편안한 한식 식사를 원하는 고객에게 적합한 공간입니다.","갈비찜으로 유명한 한식 냉면집으로, 큼직한 갈빗대와 두툼한 고기가 특징인 왕갈비찜이 대표 메뉴입니다. 서빙 시 직원이 직접 뼈를 발라줘 먹기 편하며, 자작한 국물과 부드러운 고기 맛이 돋보입니다. 식사 후에는 시원한 냉면과 함께 즐기기에 좋으며, 전통적인 한식 분위기에서 가족 또는 단체 모임에 어울리는 편안한 공간입니다.","{'budget_range': '고', 'spicy_available': 'O', 'vegetarian_options': 'X', 'main_ingredients_list': ['육류', '기타', '어류'], 'low_level_category': '갈비탕, 소갈비찜, 비빔냉면', 'suitable_for': ['가족모임', '단체식사', '편안한', '전통한식'], 'food_type_list': ['고기류', '기타', '국물류', '면류'], 'temperature_list': ['온', '냉'], 'high_level_category': '한식'}"
