40377,https://www.bluer.co.kr/restaurants/40377,그레코로스팅컴퍼니,서울특별시 금천구 가산디지털2로 127-33 (가산동) 대명벨리온오피스텔104호,카페,0,N,N,,https://www.bluer.co.kr/images/bluer_b07f2637ab0c40faab9968c8dfd0fe3c.jpg,images\40377_그레코로스팅컴퍼니.jpg,"쾌적한 분위기의 카페로, 달콤하고 짭짤한 크림을 올린 그레코라테가 시그니처 메뉴다. 커피와 함께 뚱카롱도 많이 찾는다. 매장 한편에는 로스팅 기계도 있다.",126.8777911,37.47838349,"그레코로스팅컴퍼니는 서울 금천구 가산디지털단지 인근에 위치한 카페로, 2018년 8월 14일에 개업했습니다. 이 카페는 20년 경력의 커피로스터가 직접 원두를 로스팅하여 스페셜티 커피를 제공하는 것이 특징입니다. 매장 한편에는 로스팅 기계가 비치되어 있으며, 쾌적한 분위기와 작은 공원을 끼고 있는 입지로 도심 속 여유를 느낄 수 있습니다. 시그니처 메뉴는 달콤하고 짭짤한 크림이 올라간 '그레코라테'이며, 커피와 곁들여 즐길 수 있는 '뚱카롱'도 인기입니다. 주요 메뉴로는 에스프레소, 아메리카노, 콜드브루, 카페라테, 초코라테, 로얄밀크티, 요거트스무디, 자몽/청포도주스 등이 있으며, 가격대는 3,000원~6,000원으로 합리적입니다. 매장에는 테라스가 있어 쾌적한 분위기에서 커피를 즐길 수 있고, 연중무휴로 월~금 07:30~20:00, 토 10:00~17:00, 일 10:00~21:00까지 운영됩니다. 리뷰는 아직 등록되어 있지 않으며, 블루리본 서베이 선정 및 레드리본 등재는 되지 않았습니다.","20년 경력의 커피로스터가 직접 원두를 볶아내는 스페셜티 카페로, 쾌적하고 아늑한 분위기와 작은 공원을 끼고 있는 입지가 특징입니다. 달콤하고 짭짤한 크림을 올린 그레코라테가 시그니처 메뉴이며, 커피와 함께 뚱카롱 등 다양한 디저트도 인기가 많습니다. 매장 내에는 로스팅 기계가 비치되어 있어 커피의 신선함을 느낄 수 있고, 테라스가 있어 여유로운 시간을 보내기에 적합합니다.","{'budget_range': '저', 'spicy_available': 'X', 'vegetarian_options': 'X', 'main_ingredients_list': ['기타'], 'low_level_category': '카페', 'suitable_for': ['쾌적한', '아늑한', '여유로운', '공원 인접', '테라스', '커피 애호가', '디저트 즐기기'], 'food_type_list': ['음료', '디저트류'], 'temperature_list': ['기타', '상'], 'high_level_category': '디저트류'}"
6371,https://www.bluer.co.kr/restaurants/6371,와우신내떡,서울특별시 동작구 만양로14가길 3 (노량진동),떡볶이,0,N,N,,https://www.bluer.co.kr/assets/image/restaurant/img_restaruant_no_image.png?v=3,images\6371_와우신내떡.png,"매운 떡볶이로 유명한 집. 떡볶이 종류도 달콤떡볶이, 치즈떡볶이 등 퓨전 스타일로 여러 가지 갖추고 있다. 2인세트, 3인세트 등 세트메뉴를 이용하면 보다 저렴하게 맛볼 수 있다. 매운 정도는 선택할 수 있다.",126.9451348,37.51181049,"와우신내떡은 서울 동작구 노량진동에 위치한 떡볶이 전문점으로, 매운 떡볶이로 잘 알려져 있습니다. 다양한 떡볶이 메뉴와 함께 달콤떡볶이, 치즈떡볶이 등 퓨전 스타일의 메뉴도 제공하며, 토핑, 갈릭후라이, 후라이바스켓 등 다양한 사이드 메뉴가 준비되어 있습니다. 2인세트, 3인세트 등 세트 메뉴를 통해 더욱 저렴하게 여러 메뉴를 맛볼 수 있습니다. 메뉴 가격대는 1,500원부터 11,900원까지로, 학생이나 직장인 등 다양한 고객층이 부담 없이 방문할 수 있습니다. 맵기 정도를 선택할 수 있어 매운 음식을 좋아하는 사람뿐 아니라 매운맛에 약한 사람도 함께 즐길 수 있습니다. 노량진 학원가 근처에 위치해 있어 학원생들 사이에서 인기가 높으며, 저렴한 가격과 특유의 매콤함, 그리고 매달 진행되는 이벤트로 방문의 재미를 더합니다. 내부는 캐주얼하고 활기찬 분위기로, 친구, 동료, 가족 등 다양한 모임에 적합합니다. 현재 블루리본 서베이 선정 및 레드리본, 서울 2025 선정은 되지 않았으나, 현지에서 입소문이 자자한 떡볶이집입니다.","매운 떡볶이와 다양한 퓨전 떡볶이 메뉴로 유명한 캐주얼 분식집입니다. 달콤떡볶이, 치즈떡볶이 등 여러 스타일의 메뉴와 다양한 사이드, 세트 구성이 준비되어 있어 친구나 동료, 학생들이 부담 없이 방문하기 좋습니다. 맵기 선택이 가능해 매운맛을 즐기는 고객뿐 아니라 다양한 취향의 사람들이 함께 어울릴 수 있습니다. 학원가 근처에 위치해 활기차고 젊은 분위기가 특징이며, 저렴한 가격과 매달 이벤트로 방문의 재미도 더합니다.","{'budget_range': '저', 'spicy_available': 'O', 'vegetarian_options': 'X', 'main_ingredients_list': ['기타'], 'low_level_category': '떡볶이', 'suitable_for': ['가성비', '학생', '친구모임', '활기찬', '젊은', '이벤트', '캐주얼'], 'food_type_list': ['기타', '고기류', '디저트류'], 'temperature_list': ['기타', '온', '상'], 'high_level_category': '한식'}"
34109,https://www.bluer.co.kr/restaurants/34109,수미양가,서울특별시 송파구 백제고분로43길 8 (송파동),일식징기스칸,0,N,N,,https://www.bluer.co.kr/images/es_2c3ea8e1b8544ef1b64a1b73e15c799a.jpg,images\34109_수미양가.jpg,"6개월 미만의 어린 양고기 램을 숯불에 구워 먹는 곳. 프렌치랙은 등심과 갈빗살을 같이 즐길 수 있는 부위로, 하루에 한정수량만 판매한다. 고기를 다 먹은 후에는 비빔국수로 마무리할 것을 추천.",127.1097808,37.50823577,"수미양가는 서울 송파구 백제고분로43길에 위치한 일식 징기스칸 전문점으로, 2022년 8월 31일에 개업했습니다. 이곳은 6개월 미만의 어린 양고기 램을 숯불에 구워내는 것이 특징이며, 프렌치랙(등심과 갈빗살이 함께 붙은 부위)은 하루 한정수량만 제공됩니다. 주요 메뉴로는 양등심, 숄더랙, 프렌치랙 등 다양한 부위의 양고기와 함께, 식사 마무리로 매콤한 비빔국수를 추천합니다. 메뉴 가격대는 8,000원에서 35,000원 사이이며, 양고기는 140~180g 내외로 제공됩니다. 매장은 카운터석이 있으며, 석촌역 2번 출구에서 도보 약 300m 거리에 위치해 접근성이 좋습니다. 연중무휴로 운영되며, 영업시간은 매일 12:00~22:00(브레이크타임 15:00~17:00, 마지막 주문 14:00/21:00)입니다. 인스타그램 계정(@soomiyangga)도 운영 중입니다. 현재 블루리본, 레드리본 등 공식 선정은 받지 않았으며, 독자 리뷰는 아직 등록되지 않았습니다.","수미양가는 어린 양고기 램을 숯불에 구워내는 일식 징기스칸 전문점으로, 프렌치랙 등 다양한 양고기 부위를 한정수량으로 제공하며, 식사 마무리로 매콤한 비빔국수도 추천되는 곳입니다. 매장은 캐주얼하고 활기찬 분위기로, 카운터석이 마련되어 있어 혼밥이나 소규모 모임에도 적합합니다. 육류 중심의 메뉴 구성에 양식 테마를 일부 가미하고 있습니다.","{'budget_range': '중', 'spicy_available': 'O', 'vegetarian_options': 'X', 'main_ingredients_list': ['기타', '육류'], 'low_level_category': '일식징기스칸', 'suitable_for': ['혼밥', '소규모 모임', '캐주얼', '활기찬'], 'food_type_list': ['면류', '고기류'], 'temperature_list': ['냉', '온'], 'high_level_category': '일식'}"
29631,https://www.bluer.co.kr/restaurants/29631,나리의집(청담점),서울특별시 강남구 선릉로152길 25 (청담동),"청국장, 삼겹살",0,N,N,,https://www.bluer.co.kr/images/es_074ae60fc61a45b1905c842766ae6836.jpg,images\29631_나리의집(청담점).jpg,"이태원에서 냉동삼겹살로 유명한 나리의집 청담점. 호일을 깐 불판 위에 냉동삼겹살을 구워 먹는 맛이 좋으며, 파절임을 곁들이면 더욱 맛있다. 구수하게 끓인 청국장도 단연 인기. 새벽 두 시까지 영업하는 것이 큰 장점이다.",127.0416925,37.52448046,"나리의집(청담점)은 서울 강남구 청담동에 위치한 한식 전문점으로, 이태원 본점에서 냉동삼겹살로 유명세를 떨친 분점입니다. 이곳의 대표 메뉴는 호일을 깐 불판 위에 구워먹는 냉동삼겹살로, 파절임과 함께 먹으면 더욱 맛있다는 평을 받고 있습니다. 또한 구수하게 끓인 청국장 역시 단연 인기 메뉴로 꼽힙니다. 그 외에도 된장찌개, 순두부찌개, 김치섞어찌개 등 다양한 찌개류와 삼겹살을 합리적인 가격(7,000~13,000원)에 제공합니다. 모든 메뉴는 한식 스타일의 따뜻한 국물 요리 또는 고기 요리로 구성되어 있습니다. 매장은 새벽 2시까지 영업하며 연중무휴로 운영되어 늦은 시간에도 방문이 가능합니다. 발레파킹 서비스와 함께, 연인과 함께 방문하기 좋은 분위기라는 평가를 받고 있습니다. 2018년 9월 29일에 개업하였으며, 학동사거리에서 압구정로데오역 방향으로 직진 후 버거킹에서 우회전하면 좌측에 위치해 접근성도 뛰어납니다. 블루리본 서베이의 'Pick'으로 선정된 적이 있으며, 현재 레드리본이나 서울 2025 선정에는 포함되어 있지 않습니다.","이곳은 이태원에서 냉동삼겹살로 유명한 한식 전문점의 청담 분점으로, 호일을 깐 불판에서 구워먹는 냉동삼겹살과 파절임의 조화가 인기입니다. 구수한 청국장 등 따뜻한 국물 한식 메뉴가 강점이며, 새벽 2시까지 영업하는 점이 특징입니다. 연인과 함께 방문하기 좋은 분위기와 연중무휴 운영으로 늦은 시간 식사나 모임에 적합합니다.","{'budget_range': '저', 'spicy_available': 'O', 'vegetarian_options': 'O', 'main_ingredients_list': ['기타', '육류'], 'low_level_category': '청국장, 삼겹살', 'suitable_for': ['데이트', '연인', '야간식사', '늦은모임', '연중무휴'], 'food_type_list': ['국물류', '고기류'], 'temperature_list': ['온'], 'high_level_category': '한식'}"
42570,https://www.bluer.co.kr/restaurants/42570,금고기(마포본점),"서울특별시 마포구 도화길 20-6 (도화동) 도화주택 1층, 2층","돼지고기구이, 소고기구이",0,N,N,,https://www.bluer.co.kr/assets/image/restaurant/img_restaruant_no_image.png?v=3,images\42570_금고기(마포본점).png,"꼬들살, 새우살, 쫄깃살 등 돼지 특수부위로 인기 있는 돼지고기구이 전문점. 모둠세트를 많이 찾으며, 고사리와 파채를 함께 구워 먹는다. 삼겹살부터 왕갈비, 차돌박이 등 다양한 고기가 구비되어 있는 곳으로, 정성껏 구워주는 고기를 맛볼 수 있다.",126.9482317,37.54006902,"금고기(마포본점)는 서울 마포구 도화동에 위치한 돼지고기구이와 소고기구이 전문점으로, 2023년 9월 27일에 개업했습니다. 꼬들살, 새우살, 쫄깃살 등 다양한 돼지 특수부위와 함께 삼겹살, 왕갈비, 한우차돌박이, 소갈비살 등 다양한 고기 메뉴를 제공합니다. 대표 메뉴로는 꼬들삼각살(150g, 15,000원), 으뜸한돈삼겹살(150g, 16,000원), 숯불새우살(150g, 17,000원), 숯불한우차돌박이1++(100g, 19,000원), 명품소갈비살(150g, 25,000원), 숯불왕갈비(690g, 49,000원), 금고기2인모둠(2500g, 49,000원)이 있으며, 가격대는 15,000원에서 49,000원 사이입니다. 모둠세트가 인기가 많고, 고사리와 파채를 함께 구워 먹는 것이 특징입니다. 모든 메뉴는 맵지 않으며, 주재료는 육류입니다. 매장은 월~토요일 15:00~00:30까지 영업하며, 매주 일요일은 휴무입니다. 정성껏 고기를 구워주는 서비스와 새벽까지 영업하는 점이 장점이며, 가족, 친구, 소규모 모임 등 다양한 상황에 적합합니다. 블루리본 서베이의 리본 선정은 없으며, 리뷰는 아직 등록되지 않았습니다.","금고기(마포본점)는 돼지 특수부위와 다양한 고기를 맛볼 수 있는 한식 고기구이 전문점입니다. 고사리와 파채를 곁들여 먹는 독특한 방식과 정성스럽게 구워주는 서비스가 특징이며, 모둠세트 등 다양한 메뉴 구성이 강점입니다. 새벽까지 영업해 여유로운 저녁 모임이나 친구, 가족과의 식사에 어울리는 활기찬 분위기를 갖추고 있습니다.","{'budget_range': '중', 'spicy_available': 'X', 'vegetarian_options': 'X', 'main_ingredients_list': ['육류'], 'low_level_category': '돼지고기구이, 소고기구이', 'suitable_for': ['활기찬', '저녁모임', '친구모임', '가족모임'], 'food_type_list': ['고기류'], 'temperature_list': ['온'], 'high_level_category': '한식'}"
29839,https://www.bluer.co.kr/restaurants/29839,칙피스,서울특별시 강남구 강남대로152길 69 (신사동),"샌드위치, 미국식, 지중해식",1,Y,Y,레드리본 선정 서울 2025 선정,https://www.bluer.co.kr/assets/image/restaurant/img_restaruant_no_image.png?v=3,images\29839_칙피스.png,미국 뉴욕 스타일의 지중해식 샌드위치를 선보이는 곳. 중동 지역에서 주로 먹는 피타빵에 재료를 알차게 채운 피타샌드위치와 피타샐러드 등을 선보인다. 가격도 합리적인 편. 채식주의자를 위한 비건 메뉴도 갖추고 있다.,127.0247332,37.51912445,"칙피스는 서울 강남구 신사동에 위치한 미국 뉴욕 스타일의 지중해식 샌드위치 전문점입니다. 2018년 12월 15일에 개업했으며, 블루리본 서베이 2025년판에 선정된 레드리본 맛집입니다. 이곳은 중동 지역에서 주로 먹는 피타빵에 다양한 재료를 채운 피타샌드위치와 피타샐러드, 샥슈카, 후무스 등 지중해식 메뉴를 합리적인 가격(1만원대)에 제공합니다. 대표 메뉴로는 로스트치킨샐러드, 샥슈카, 비건샐러드, 오리지널후무스, 팔라펠라이스, 후레쉬아보카도샐러드 등이 있으며, 채식주의자를 위한 비건 메뉴도 다양하게 마련되어 있습니다. 모든 메뉴는 맵지 않으며, 디저트류와 기타 메뉴가 주를 이룹니다. 매장은 신사역 8번 출구에서 도보로 접근 가능하며, 발레파킹 서비스도 제공합니다. 영업시간은 월~일 11:30~20:30(브레이크타임 15:00~16:00, 마지막 주문 20:00)이며, 명절 연휴에는 휴무입니다. 인스타그램과 공식 홈페이지도 운영하고 있습니다. 현대적이고 캐주얼한 분위기에서 건강하고 신선한 지중해식 요리를 즐길 수 있는 곳으로, 비건 및 채식 식단을 선호하는 고객에게 특히 추천할 만합니다.","칙피스는 레드리본 선정과 서울 2025 맛집에 등재된 뉴욕 스타일 지중해식 샌드위치 전문점입니다. 중동식 피타빵에 다양한 재료를 알차게 채운 피타샌드위치와 샐러드, 후무스 등 건강하고 신선한 메뉴를 선보입니다. 비건 메뉴가 다양하게 준비되어 있어 채식주의자도 만족할 수 있으며, 현대적이고 캐주얼한 분위기에서 지중해의 맛과 문화를 경험할 수 있습니다. 양식 테마가 중심이며, 합리적인 가격대와 트렌디한 감각이 돋보입니다.","{'budget_range': '중', 'spicy_available': 'X', 'vegetarian_options': 'O', 'main_ingredients_list': ['조류', '기타'], 'low_level_category': '샌드위치, 미국식, 지중해식', 'suitable_for': ['레드리본 선정', '서울 2025 선정', '비건', '채식', '가성비', '트렌디', '캐주얼', '건강식', '현대적'], 'food_type_list': ['디저트류', '기타'], 'temperature_list': ['상', '온'], 'high_level_category': '양식'}"
15387,https://www.bluer.co.kr/restaurants/15387,지리산왕재봉흑돼지,서울특별시 강동구 상암로 26 (암사동) 선사타워빌딩,돼지고기구이,0,N,N,,https://www.bluer.co.kr/assets/image/restaurant/img_restaruant_no_image.png?v=3,images\15387_지리산왕재봉흑돼지.png,국내산 최고급 흑돼지만을 사용한다. 지방층이 적고 각 층이 확실히 구분되는 윤기나는 삼겹살을 보면 탄성이 절로 나온다. 밥을 시키면 된장찌개 대신 고기가 듬뿍 담긴 김치찌개가 나온다.,127.1263946,37.550448,"지리산왕재봉흑돼지는 서울 강동구 암사동 선사타워빌딩에 위치한 돼지고기구이 전문점입니다. 이곳은 국내산 최고급 흑돼지만을 사용하여 지방층이 적고 각 층이 확실히 구분되는 윤기나는 삼겹살과 목살을 주력 메뉴로 제공합니다. 대표 메뉴로는 흑돼지삼겹살(180g)과 흑돼지목살(180g)이 각각 13,000원, 김치찌개가 6,000원에 제공되며, 밥을 주문하면 된장찌개 대신 고기가 듬뿍 들어간 김치찌개가 함께 나오는 것이 특징입니다. 전체 메뉴 가격대는 6,000원에서 13,000원으로, 합리적인 중가 수준입니다. 매장은 연중무휴로 운영되며, 영업시간은 매일 11:00~22:00입니다. 암사역 3번 출구에서 한강공원 방향으로 직진하면 좌측에 위치해 있어 접근성이 좋습니다. 매장 분위기는 가족, 친구, 직장 동료 등 다양한 모임에 적합하며, 전통적인 한식 고깃집의 정체성을 잘 살리고 있습니다. 맵기 있는 김치찌개도 제공되어 매운 음식을 선호하는 고객도 만족시킬 수 있습니다. 채식 메뉴는 별도로 제공되지 않습니다.","국내산 최고급 흑돼지로 만든 삼겹살과 목살 구이, 고기가 듬뿍 들어간 김치찌개가 특징인 전통 한식 고깃집입니다. 정통 한식 테마로, 가족이나 친구, 직장 동료와 함께 어울리기 좋은 편안한 분위기를 자랑합니다. 연중무휴로 운영되어 언제든 방문하기 좋으며, 푸짐하고 정겨운 한식 고기집의 정체성을 느낄 수 있습니다.","{'budget_range': '중', 'spicy_available': 'O', 'vegetarian_options': 'X', 'main_ingredients_list': ['기타', '육류'], 'low_level_category': '돼지고기구이', 'suitable_for': ['가족모임', '친구모임', '회식', '편안한', '정겨운'], 'food_type_list': ['국물류', '고기류'], 'temperature_list': ['온'], 'high_level_category': '한식'}"
4855,https://www.bluer.co.kr/restaurants/4855,갯바위,서울특별시 관악구 남부순환로216길 13 (봉천동),대구탕,2,N,Y,서울 2025 선정,https://www.bluer.co.kr/images/4855_thumb.jpg,images\4855_갯바위.jpg,신선한 생대구를 사용해 얼큰하게 끓인 대구탕 맛이 일품인 곳. 깔끔한 국물 맛이 좋으며 함께 나오는 반찬이 맛있기로도 유명하다. 자연산 생우럭탕과 생민어를 사용한 민어탕도 단연 추천. 재료가 떨어지면 일찍 닫는다.,126.9491216,37.48087855,"갯바위는 1994년 개업 이래 서울 관악구에서 신선한 생대구를 사용한 얼큰한 대구탕으로 명성을 쌓아온 한식 전문점입니다. 서울 2025 블루리본 서베이 선정 맛집으로, 2개의 리본을 획득하였으며, 대표 메뉴인 생대구탕은 깔끔하고 깊은 국물 맛과 함께 정성스럽게 준비된 반찬으로 많은 사랑을 받고 있습니다. 생민어탕, 자연산 생우럭탕, 영덕대게 등도 제공하며, 메뉴는 주로 어류와 패류를 활용한 국물 및 해산물 요리로 구성되어 있습니다. 생대구탕은 매콤하게, 생민어탕과 영덕대게는 맵지 않게 제공되어 취향에 따라 선택할 수 있습니다. 모든 메뉴는 신선한 재료가 소진되면 조기 마감될 수 있습니다. 가격대는 27,000원부터 시작하며, 일부 메뉴는 시가로 변동됩니다. 매장은 서울대입구역 인근에 위치해 있으며, 평일에는 11:00~20:00, 토요일은 11:00~15:00까지 영업합니다(일요일 및 공휴일 휴무). 예약은 불가하며, 아늑하고 전통적인 분위기에서 가족 모임이나 지역 주민들의 식사에 적합합니다.","서울 2025 선정에 빛나는 한식 해산물 전문점으로, 신선한 생대구와 자연산 어류를 활용한 얼큰한 탕 요리가 대표적입니다. 깔끔하고 깊은 국물 맛, 정갈한 반찬, 전통적인 분위기가 특징이며, 한식의 정체성을 충실히 살린 정직한 식당입니다. 가족 단위 식사, 지역 주민의 일상적인 식사, 전통 한식 경험에 적합한 곳입니다.","{'budget_range': '중', 'spicy_available': 'O', 'vegetarian_options': 'X', 'main_ingredients_list': ['어류', '패류'], 'low_level_category': '대구탕', 'suitable_for': ['서울 2025 선정', '전통적인', '가족모임', '지역주민', '정통한식'], 'food_type_list': ['국물류', '해산물류'], 'temperature_list': ['온'], 'high_level_category': '한식'}"
7179,https://www.bluer.co.kr/restaurants/7179,패트릭스와플,서울특별시 영등포구 국제금융로 112 (여의도동) 상아빌딩 1층,와플,0,N,Y,서울 2025 선정,https://www.bluer.co.kr/assets/image/restaurant/img_restaruant_no_image.png?v=3,images\7179_패트릭스와플.png,벨기에인 두 명이 운영하는 벨기에식 와플집. 줄을 서서 먹어야 할 정도로 유명하다. 갓 구운 벨기에식 와플의 맛이 좋으며 아이스크림을 얹은 아이스크림와플도 인기 메뉴다. 테이크아웃만 전문으로 한다.,126.9339059,37.51839684,"패트릭스와플은 서울 영등포구 여의도동에 위치한 벨기에식 와플 전문점으로, 벨기에인 두 명이 직접 운영합니다. 2006년에 개업한 이 곳은 갓 구운 벨기에식 와플로 유명해 평일과 주말 모두 긴 줄이 생길 정도로 인기가 많으며, 테이크아웃만 전문으로 합니다. 대표 메뉴로는 오리지널벨기에와플(3,200원), 아이스크림와플(4,500원, 딸기·초코·카라멜 시럽 중 선택 가능), 빼빼로와플(3,800원), 바닐라아이스크림(1,300원) 등이 있으며, 전체 메뉴 가격대는 1,300원~4,500원으로 합리적입니다. 맵지 않은 디저트류 메뉴만 제공하며, 아이스크림와플 등 다양한 와플 메뉴가 특히 인기입니다. 서울 2025 맛집으로 선정된 이 곳은 여의도침례교회 옆 상아빌딩 1층에 위치해 있으며, 월~토요일 11:00~19:30 영업(일요일 휴무)합니다. 실내 좌석 없이 테이크아웃만 가능해 간편하게 벨기에 와플을 즐기고 싶은 이들에게 추천됩니다.","벨기에인 두 명이 운영하는 벨기에식 와플 전문 테이크아웃 디저트숍. 서울 2025 선정 맛집으로, 갓 구운 벨기에식 와플과 아이스크림와플 등 다양한 와플이 인기다. 줄을 서서 먹을 정도로 유명하며, 캐주얼하고 활기찬 분위기에서 빠르고 간편하게 정통 와플 디저트를 즐길 수 있다.","{'budget_range': '저', 'spicy_available': 'X', 'vegetarian_options': 'X', 'main_ingredients_list': ['기타'], 'low_level_category': '와플', 'suitable_for': ['서울 2025 선정', '테이크아웃', '캐주얼', '간편식', '디저트', '혼밥'], 'food_type_list': ['디저트류'], 'temperature_list': ['상', '냉'], 'high_level_category': '디저트류'}"
